{
  "模板名称": "设备订单增长到收入确认传导模板",
  "模板等级": "历史支持模板候选",
  "适用范围": "半导体设备公司订单披露、财报订单变化和客户验证推进后的收入确认跟踪。",
  "不适用范围": "无法交付、订单无法验收、订单价格或毛利率显著低于历史均值的情形。",
  "触发条件": ["新签订单同比或环比显著增长", "客户验证进入导入或批量采购阶段"],
  "核心变量": ["新签订单", "订单能见度", "合同负债", "收入确认节奏", "毛利率"],
  "传导路径": [
    {
      "来源变量": "新签订单",
      "目标变量": "收入确认节奏",
      "方向映射": "订单增长且交付按期推进，未来收入确认概率提升",
      "滞后窗口": "通常 1-3 个季度",
      "边界条件": "交付延期、验收延迟或订单毛利率低于历史均值时传导减弱"
    }
  ],
  "验证信号": ["合同负债变化", "收入确认进度", "客户验收节点", "毛利率变化"],
  "阻断条件": ["交付延期", "验收未完成", "毛利率低于历史均值", "客户扩产计划下修"],
  "历史样本": [
    {
      "样本对象": "历史样本 A 设备公司",
      "触发时间": "2023Q2",
      "兑现或失效时间": "2023Q4",
      "验证指标": "收入确认增速和合同负债变化",
      "结果": "兑现",
      "来源位置": "行业深度第 19 页历史样本表"
    }
  ],
  "反例或失效样本": ["历史样本 B 中低毛利订单导致利润传导弱于收入传导"],
  "证据来源": {
    "材料数量": 4,
    "独立原始来源数量": 3,
    "历史样本数量": 2,
    "关键来源": ["某半导体设备公司 2025Q1 财报", "半导体设备行业深度", "历史案例复盘表"]
  },
  "可信度说明": "具备多来源和历史样本支持，但不同设备环节交付周期差异仍需专家校准。",
  "待校准问题": ["不同设备环节的滞后窗口是否应拆分", "毛利率阻断阈值应使用公司历史均值还是行业分位数"]
}
